{
  "id": "example-westlands-1br",
  "name": "Westlands 1-bed",
  "timezone": "Africa/Nairobi",
  "bedrooms": 1,
  "areas": {
    "accept": [
      "Westlands",
      "Parklands",
      "Highridge",
      "Nairobi CBD",
      "CBD",
      "town",
      "Riverside",
      "Muthaiga",
      "Pangani",
      "Upper Hill",
      "Upperhill",
      "Ngara",
      "Kileleshwa",
      "Kile",
      "Hurlingham",
      "Kilimani",
      "Milimani",
      "Lavington",
      "Spring Valley",
      "Yaya Centre",
      "Yaya",
      "Adams Arcade",
      "Adams",
      "Gigiri",
      "Village Market",
      "Runda",
      "Loresho",
      "Kitisuru",
      "Nyari",
      "Kangemi",
      "Mountain View",
      "Sarit",
      "Sarit Centre",
      "ABC Place",
      "Chiromo",
      "Rhapta",
      "Raphta",
      "Mpaka Road",
      "Woodvale",
      "Brookside",
      "Delta",
      "GTC",
      "Museum Hill",
      "Waiyaki Way",
      "Peponi",
      "Kyuna",
      "Lower Kabete",
      "General Mathenge",
      "Deep Sea"
    ],
    "borderline": [
      "Dagoretti Corner",
      "Dagoretti",
      "JKIA",
      "Two Rivers",
      "Ruaka",
      "Kikuyu",
      "Lang'ata",
      "Langata",
      "Karen"
    ],
    "reject": [
      "Ongata Rongai",
      "Rongai",
      "Thindigua",
      "Kiambu Road",
      "Kiambu Rd",
      "Ngong",
      "Ngong town",
      "Eastlands",
      "Donholm",
      "Buruburu",
      "Umoja",
      "Kayole",
      "Utawala",
      "Athi River",
      "Syokimau",
      "Ruiru",
      "Juja",
      "Thika",
      "Thika Road",
      "Thika Rd",
      "Mlolongo",
      "South B",
      "South C",
      "Kasarani",
      "Embakasi",
      "Bungoma",
      "Kericho",
      "Nyali",
      "Watamu",
      "Mombasa",
      "Kisumu",
      "Nakuru",
      "Eldoret",
      "Diani",
      "Malindi",
      "Naivasha"
    ]
  },
  "listing": {
    "headline": "a 1-bedroom in Westlands",
    "headlineSw": "1-bedroom Westlands",
    "currency": "Ksh",
    "highlights": [
      "fibre Wi-Fi",
      "backup power"
    ]
  }
}
